{
  "library": "vercel-ai-genai",
  "version": "7.0.142",
  "recorded_at": "2026-10-17T20:45:24Z",
  "recorder": {
    "runtime": "node 24.11.1",
    "otel_sdk": "2.12.0",
    "harness": "sdks/fixtures/otlp/record@e0893b3"
  },
  "scenarios": [
    {
      "name": "error",
      "export": {
        "content_type": "application/json",
        "body_base64": "eyJyZXNvdXJjZVNwYW5zIjpbeyJyZXNvdXJjZSI6eyJhdHRyaWJ1dGVzIjpbeyJrZXkiOiJzZXJ2aWNlLm5hbWUiLCJ2YWx1ZSI6eyJzdHJpbmdWYWx1ZSI6InN1cHBvcnQtYm90In19LHsia2V5Ijoic2VydmljZS52ZXJzaW9uIiwidmFsdWUiOnsic3RyaW5nVmFsdWUiOiIxLjAuMCJ9fSx7ImtleSI6ImRlcGxveW1lbnQuZW52aXJvbm1lbnQubmFtZSIsInZhbHVlIjp7InN0cmluZ1ZhbHVlIjoicHJvZHVjdGlvbiJ9fV0sImRyb3BwZWRBdHRyaWJ1dGVzQ291bnQiOjB9LCJzY29wZVNwYW5zIjpbeyJzY29wZSI6eyJuYW1lIjoic3BhbmxpZ2h0In0sInNwYW5zIjpbeyJ0cmFjZUlkIjoiN2YyODNjOGQ3MzIxODA2MDRhNTVlMjY0ZTA1ZGZjZDMiLCJzcGFuSWQiOiIxYjE4OWZkNWU3YzUwMDhlIiwicGFyZW50U3BhbklkIjoiZmFkY2QzYjk1NGVhMTRhOCIsIm5hbWUiOiJjaGF0IGdwdC00LjEtbWluaSIsImtpbmQiOjMsInN0YXJ0VGltZVVuaXhOYW5vIjoiMTc5MjI2OTkyNDc0MDAwMDAwMCIsImVuZFRpbWVVbml4TmFubyI6IjE3OTIyNjk5MjQ3NDYwMDAwMDAiLCJhdHRyaWJ1dGVzIjpbeyJrZXkiOiJnZW5fYWkub3BlcmF0aW9uLm5hbWUiLCJ2YWx1ZSI6eyJzdHJpbmdWYWx1ZSI6ImNoYXQifX0seyJrZXkiOiJnZW5fYWkucHJvdmlkZXIubmFtZSIsInZhbHVlIjp7InN0cmluZ1ZhbHVlIjoib3BlbmFpIn19LHsia2V5IjoiZ2VuX2FpLnJlcXVlc3QubW9kZWwiLCJ2YWx1ZSI6eyJzdHJpbmdWYWx1ZSI6ImdwdC00LjEtbWluaSJ9fSx7ImtleSI6Imdlbl9haS5pbnB1dC5tZXNzYWdlcyIsInZhbHVlIjp7InN0cmluZ1ZhbHVlIjoiW3tcInJvbGVcIjpcInVzZXJcIixcInBhcnRzXCI6W3tcInR5cGVcIjpcInRleHRcIixcImNvbnRlbnRcIjpcIlNheSBoZWxsbyBpbiBmaXZlIHdvcmRzLlwifV19XSJ9fSx7ImtleSI6Imh0dHAucmVzcG9uc2Uuc3RhdHVzX2NvZGUiLCJ2YWx1ZSI6eyJpbnRWYWx1ZSI6NDI5fX1dLCJkcm9wcGVkQXR0cmlidXRlc0NvdW50IjowLCJldmVudHMiOlt7ImF0dHJpYnV0ZXMiOlt7ImtleSI6ImV4Y2VwdGlvbi50eXBlIiwidmFsdWUiOnsic3RyaW5nVmFsdWUiOiJBSV9BUElDYWxsRXJyb3IifX0seyJrZXkiOiJleGNlcHRpb24ubWVzc2FnZSIsInZhbHVlIjp7InN0cmluZ1ZhbHVlIjoiUmF0ZSBsaW1pdCByZWFjaGVkIGZvciBncHQtNC4xLW1pbmkgaW4gb3JnYW5pemF0aW9uIG9yZy10ZXN0IG9uIHJlcXVlc3RzIHBlciBtaW4gKFJQTSk6IExpbWl0IDMsIFVzZWQgMywgUmVxdWVzdGVkIDEuIFBsZWFzZSB0cnkgYWdhaW4gaW4gMjBzLiJ9fSx7ImtleSI6ImV4Y2VwdGlvbi5zdGFja3RyYWNlIiwidmFsdWUiOnsic3RyaW5nVmFsdWUiOiJBSV9BUElDYWxsRXJyb3I6IFJhdGUgbGltaXQgcmVhY2hlZCBmb3IgZ3B0LTQuMS1taW5pIGluIG9yZ2FuaXphdGlvbiBvcmctdGVzdCBvbiByZXF1ZXN0cyBwZXIgbWluIChSUE0pOiBMaW1pdCAzLCBVc2VkIDMsIFJlcXVlc3RlZCAxLiBQbGVhc2UgdHJ5IGFnYWluIGluIDIwcy5cbiAgICBhdCBmaWxlOi8vL3ByaXZhdGUvdG1wL3NwYW5saWdodC1yZWNvcmQtbm9kZS1IM2FKdDcvbm9kZV9tb2R1bGVzL0BhaS1zZGsvcHJvdmlkZXItdXRpbHMvZGlzdC9pbmRleC5qczozODQ0OjExXG4gICAgYXQgcHJvY2Vzcy5wcm9jZXNzVGlja3NBbmRSZWplY3Rpb25zIChub2RlOmludGVybmFsL3Byb2Nlc3MvdGFza19xdWV1ZXM6MTAzOjUpXG4gICAgYXQgYXN5bmMgcG9zdFRvQXBpIChmaWxlOi8vL3ByaXZhdGUvdG1wL3NwYW5saWdodC1yZWNvcmQtbm9kZS1IM2FKdDcvbm9kZV9tb2R1bGVzL0BhaS1zZGsvcHJvdmlkZXItdXRpbHMvZGlzdC9pbmRleC5qczozNTUyOjI0KVxuICAgIGF0IGFzeW5jIHBvc3RKc29uVG9BcGkgKGZpbGU6Ly8vcHJpdmF0ZS90bXAvc3BhbmxpZ2h0LXJlY29yZC1ub2RlLUgzYUp0Ny9ub2RlX21vZHVsZXMvQGFpLXNkay9wcm92aWRlci11dGlscy9kaXN0L2luZGV4LmpzOjM1MTM6MTI3KVxuICAgIGF0IGFzeW5jIE9wZW5BSUNoYXRMYW5ndWFnZU1vZGVsLmRvR2VuZXJhdGUgKGZpbGU6Ly8vcHJpdmF0ZS90bXAvc3BhbmxpZ2h0LXJlY29yZC1ub2RlLUgzYUp0Ny9ub2RlX21vZHVsZXMvQGFpLXNkay9vcGVuYWkvZGlzdC9pbmRleC5qczoxMzQ2OjcxKVxuICAgIGF0IGFzeW5jIGV4ZWN1dGUgKGZpbGU6Ly8vcHJpdmF0ZS90bXAvc3BhbmxpZ2h0LXJlY29yZC1ub2RlLUgzYUp0Ny9ub2RlX21vZHVsZXMvYWkvZGlzdC9pbmRleC5qczo1NjUwOjMxKVxuICAgIGF0IGFzeW5jIHJ1bldpdGhUcmFjaW5nQ2hhbm5lbFNwYW4gKGZpbGU6Ly8vcHJpdmF0ZS90bXAvc3BhbmxpZ2h0LXJlY29yZC1ub2RlLUgzYUp0Ny9ub2RlX21vZHVsZXMvYWkvZGlzdC9pbmRleC5qczo0Mzk0OjgwKVxuICAgIGF0IGFzeW5jIGV4ZWN1dGVMYW5ndWFnZU1vZGVsQ2FsbCAoZmlsZTovLy9wcml2YXRlL3RtcC9zcGFubGlnaHQtcmVjb3JkLW5vZGUtSDNhSnQ3L25vZGVfbW9kdWxlcy9haS9kaXN0L2luZGV4LmpzOjQ1OTM6MTEpXG4gICAgYXQgYXN5bmMgZmlsZTovLy9wcml2YXRlL3RtcC9zcGFubGlnaHQtcmVjb3JkLW5vZGUtSDNhSnQ3L25vZGVfbW9kdWxlcy9haS9kaXN0L2luZGV4LmpzOjU2NDg6MjRcbiAgICBhdCBhc3luYyByZXRyeVdpdGhFeHBvbmVudGlhbEJhY2tvZmZJbnRlcm5hbCAoZmlsZTovLy9wcml2YXRlL3RtcC9zcGFubGlnaHQtcmVjb3JkLW5vZGUtSDNhSnQ3L25vZGVfbW9kdWxlcy9haS9ub2RlX21vZHVsZXMvQGFpLXNkay9wcm92aWRlci11dGlscy9kaXN0L2luZGV4LmpzOjM3Mjg6MTApIn19XSwibmFtZSI6ImV4Y2VwdGlvbiIsInRpbWVVbml4TmFubyI6IjE3OTIyNjk5MjQ3NDUwMDAwMDAiLCJkcm9wcGVkQXR0cmlidXRlc0NvdW50IjowfV0sImRyb3BwZWRFdmVudHNDb3VudCI6MCwic3RhdHVzIjp7ImNvZGUiOjIsIm1lc3NhZ2UiOiJSYXRlIGxpbWl0IHJlYWNoZWQgZm9yIGdwdC00LjEtbWluaSBpbiBvcmdhbml6YXRpb24gb3JnLXRlc3Qgb24gcmVxdWVzdHMgcGVyIG1pbiAoUlBNKTogTGltaXQgMywgVXNlZCAzLCBSZXF1ZXN0ZWQgMS4gUGxlYXNlIHRyeSBhZ2FpbiBpbiAyMHMuIn0sImxpbmtzIjpbXSwiZHJvcHBlZExpbmtzQ291bnQiOjAsImZsYWdzIjoyNTd9LHsidHJhY2VJZCI6IjdmMjgzYzhkNzMyMTgwNjA0YTU1ZTI2NGUwNWRmY2QzIiwic3BhbklkIjoiZmFkY2QzYjk1NGVhMTRhOCIsInBhcmVudFNwYW5JZCI6Ijk1NzhkZjQ5YzYzNGRkOGYiLCJuYW1lIjoic3RlcCAxIiwia2luZCI6MSwic3RhcnRUaW1lVW5peE5hbm8iOiIxNzkyMjY5OTI0NzQwMDAwMDAwIiwiZW5kVGltZVVuaXhOYW5vIjoiMTc5MjI2OTkyNDc1MTAwMDAwMCIsImF0dHJpYnV0ZXMiOlt7ImtleSI6Imdlbl9haS5vcGVyYXRpb24ubmFtZSIsInZhbHVlIjp7InN0cmluZ1ZhbHVlIjoiYWdlbnRfc3RlcCJ9fSx7ImtleSI6Imh0dHAucmVzcG9uc2Uuc3RhdHVzX2NvZGUiLCJ2YWx1ZSI6eyJpbnRWYWx1ZSI6NDI5fX1dLCJkcm9wcGVkQXR0cmlidXRlc0NvdW50IjowLCJldmVudHMiOlt7ImF0dHJpYnV0ZXMiOlt7ImtleSI6ImV4Y2VwdGlvbi50eXBlIiwidmFsdWUiOnsic3RyaW5nVmFsdWUiOiJBSV9BUElDYWxsRXJyb3IifX0seyJrZXkiOiJleGNlcHRpb24ubWVzc2FnZSIsInZhbHVlIjp7InN0cmluZ1ZhbHVlIjoiUmF0ZSBsaW1pdCByZWFjaGVkIGZvciBncHQtNC4xLW1pbmkgaW4gb3JnYW5pemF0aW9uIG9yZy10ZXN0IG9uIHJlcXVlc3RzIHBlciBtaW4gKFJQTSk6IExpbWl0IDMsIFVzZWQgMywgUmVxdWVzdGVkIDEuIFBsZWFzZSB0cnkgYWdhaW4gaW4gMjBzLiJ9fSx7ImtleSI6ImV4Y2VwdGlvbi5zdGFja3RyYWNlIiwidmFsdWUiOnsic3RyaW5nVmFsdWUiOiJBSV9BUElDYWxsRXJyb3I6IFJhdGUgbGltaXQgcmVhY2hlZCBmb3IgZ3B0LTQuMS1taW5pIGluIG9yZ2FuaXphdGlvbiBvcmctdGVzdCBvbiByZXF1ZXN0cyBwZXIgbWluIChSUE0pOiBMaW1pdCAzLCBVc2VkIDMsIFJlcXVlc3RlZCAxLiBQbGVhc2UgdHJ5IGFnYWluIGluIDIwcy5cbiAgICBhdCBmaWxlOi8vL3ByaXZhdGUvdG1wL3NwYW5saWdodC1yZWNvcmQtbm9kZS1IM2FKdDcvbm9kZV9tb2R1bGVzL0BhaS1zZGsvcHJvdmlkZXItdXRpbHMvZGlzdC9pbmRleC5qczozODQ0OjExXG4gICAgYXQgcHJvY2Vzcy5wcm9jZXNzVGlja3NBbmRSZWplY3Rpb25zIChub2RlOmludGVybmFsL3Byb2Nlc3MvdGFza19xdWV1ZXM6MTAzOjUpXG4gICAgYXQgYXN5bmMgcG9zdFRvQXBpIChmaWxlOi8vL3ByaXZhdGUvdG1wL3NwYW5saWdodC1yZWNvcmQtbm9kZS1IM2FKdDcvbm9kZV9tb2R1bGVzL0BhaS1zZGsvcHJvdmlkZXItdXRpbHMvZGlzdC9pbmRleC5qczozNTUyOjI0KVxuICAgIGF0IGFzeW5jIHBvc3RKc29uVG9BcGkgKGZpbGU6Ly8vcHJpdmF0ZS90bXAvc3BhbmxpZ2h0LXJlY29yZC1ub2RlLUgzYUp0Ny9ub2RlX21vZHVsZXMvQGFpLXNkay9wcm92aWRlci11dGlscy9kaXN0L2luZGV4LmpzOjM1MTM6MTI3KVxuICAgIGF0IGFzeW5jIE9wZW5BSUNoYXRMYW5ndWFnZU1vZGVsLmRvR2VuZXJhdGUgKGZpbGU6Ly8vcHJpdmF0ZS90bXAvc3BhbmxpZ2h0LXJlY29yZC1ub2RlLUgzYUp0Ny9ub2RlX21vZHVsZXMvQGFpLXNkay9vcGVuYWkvZGlzdC9pbmRleC5qczoxMzQ2OjcxKVxuICAgIGF0IGFzeW5jIGV4ZWN1dGUgKGZpbGU6Ly8vcHJpdmF0ZS90bXAvc3BhbmxpZ2h0LXJlY29yZC1ub2RlLUgzYUp0Ny9ub2RlX21vZHVsZXMvYWkvZGlzdC9pbmRleC5qczo1NjUwOjMxKVxuICAgIGF0IGFzeW5jIHJ1bldpdGhUcmFjaW5nQ2hhbm5lbFNwYW4gKGZpbGU6Ly8vcHJpdmF0ZS90bXAvc3BhbmxpZ2h0LXJlY29yZC1ub2RlLUgzYUp0Ny9ub2RlX21vZHVsZXMvYWkvZGlzdC9pbmRleC5qczo0Mzk0OjgwKVxuICAgIGF0IGFzeW5jIGV4ZWN1dGVMYW5ndWFnZU1vZGVsQ2FsbCAoZmlsZTovLy9wcml2YXRlL3RtcC9zcGFubGlnaHQtcmVjb3JkLW5vZGUtSDNhSnQ3L25vZGVfbW9kdWxlcy9haS9kaXN0L2luZGV4LmpzOjQ1OTM6MTEpXG4gICAgYXQgYXN5bmMgZmlsZTovLy9wcml2YXRlL3RtcC9zcGFubGlnaHQtcmVjb3JkLW5vZGUtSDNhSnQ3L25vZGVfbW9kdWxlcy9haS9kaXN0L2luZGV4LmpzOjU2NDg6MjRcbiAgICBhdCBhc3luYyByZXRyeVdpdGhFeHBvbmVudGlhbEJhY2tvZmZJbnRlcm5hbCAoZmlsZTovLy9wcml2YXRlL3RtcC9zcGFubGlnaHQtcmVjb3JkLW5vZGUtSDNhSnQ3L25vZGVfbW9kdWxlcy9haS9ub2RlX21vZHVsZXMvQGFpLXNkay9wcm92aWRlci11dGlscy9kaXN0L2luZGV4LmpzOjM3Mjg6MTApIn19XSwibmFtZSI6ImV4Y2VwdGlvbiIsInRpbWVVbml4TmFubyI6IjE3OTIyNjk5MjQ3NTAwMDAwMDAiLCJkcm9wcGVkQXR0cmlidXRlc0NvdW50IjowfV0sImRyb3BwZWRFdmVudHNDb3VudCI6MCwic3RhdHVzIjp7ImNvZGUiOjIsIm1lc3NhZ2UiOiJSYXRlIGxpbWl0IHJlYWNoZWQgZm9yIGdwdC00LjEtbWluaSBpbiBvcmdhbml6YXRpb24gb3JnLXRlc3Qgb24gcmVxdWVzdHMgcGVyIG1pbiAoUlBNKTogTGltaXQgMywgVXNlZCAzLCBSZXF1ZXN0ZWQgMS4gUGxlYXNlIHRyeSBhZ2FpbiBpbiAyMHMuIn0sImxpbmtzIjpbXSwiZHJvcHBlZExpbmtzQ291bnQiOjAsImZsYWdzIjoyNTd9LHsidHJhY2VJZCI6IjdmMjgzYzhkNzMyMTgwNjA0YTU1ZTI2NGUwNWRmY2QzIiwic3BhbklkIjoiOTU3OGRmNDljNjM0ZGQ4ZiIsIm5hbWUiOiJpbnZva2VfYWdlbnQgZ3B0LTQuMS1taW5pIiwia2luZCI6MSwic3RhcnRUaW1lVW5peE5hbm8iOiIxNzkyMjY5OTI0NzM5MDAwMDAwIiwiZW5kVGltZVVuaXhOYW5vIjoiMTc5MjI2OTkyNDc1NDAwMDAwMCIsImF0dHJpYnV0ZXMiOlt7ImtleSI6Imdlbl9haS5vcGVyYXRpb24ubmFtZSIsInZhbHVlIjp7InN0cmluZ1ZhbHVlIjoiaW52b2tlX2FnZW50In19LHsia2V5IjoiZ2VuX2FpLnByb3ZpZGVyLm5hbWUiLCJ2YWx1ZSI6eyJzdHJpbmdWYWx1ZSI6Im9wZW5haSJ9fSx7ImtleSI6Imdlbl9haS5yZXF1ZXN0Lm1vZGVsIiwidmFsdWUiOnsic3RyaW5nVmFsdWUiOiJncHQtNC4xLW1pbmkifX0seyJrZXkiOiJnZW5fYWkuaW5wdXQubWVzc2FnZXMiLCJ2YWx1ZSI6eyJzdHJpbmdWYWx1ZSI6Ilt7XCJyb2xlXCI6XCJ1c2VyXCIsXCJwYXJ0c1wiOlt7XCJ0eXBlXCI6XCJ0ZXh0XCIsXCJjb250ZW50XCI6XCJTYXkgaGVsbG8gaW4gZml2ZSB3b3Jkcy5cIn1dfV0ifX0seyJrZXkiOiJodHRwLnJlc3BvbnNlLnN0YXR1c19jb2RlIiwidmFsdWUiOnsiaW50VmFsdWUiOjQyOX19XSwiZHJvcHBlZEF0dHJpYnV0ZXNDb3VudCI6MCwiZXZlbnRzIjpbeyJhdHRyaWJ1dGVzIjpbeyJrZXkiOiJleGNlcHRpb24udHlwZSIsInZhbHVlIjp7InN0cmluZ1ZhbHVlIjoiQUlfQVBJQ2FsbEVycm9yIn19LHsia2V5IjoiZXhjZXB0aW9uLm1lc3NhZ2UiLCJ2YWx1ZSI6eyJzdHJpbmdWYWx1ZSI6IlJhdGUgbGltaXQgcmVhY2hlZCBmb3IgZ3B0LTQuMS1taW5pIGluIG9yZ2FuaXphdGlvbiBvcmctdGVzdCBvbiByZXF1ZXN0cyBwZXIgbWluIChSUE0pOiBMaW1pdCAzLCBVc2VkIDMsIFJlcXVlc3RlZCAxLiBQbGVhc2UgdHJ5IGFnYWluIGluIDIwcy4ifX0seyJrZXkiOiJleGNlcHRpb24uc3RhY2t0cmFjZSIsInZhbHVlIjp7InN0cmluZ1ZhbHVlIjoiQUlfQVBJQ2FsbEVycm9yOiBSYXRlIGxpbWl0IHJlYWNoZWQgZm9yIGdwdC00LjEtbWluaSBpbiBvcmdhbml6YXRpb24gb3JnLXRlc3Qgb24gcmVxdWVzdHMgcGVyIG1pbiAoUlBNKTogTGltaXQgMywgVXNlZCAzLCBSZXF1ZXN0ZWQgMS4gUGxlYXNlIHRyeSBhZ2FpbiBpbiAyMHMuXG4gICAgYXQgZmlsZTovLy9wcml2YXRlL3RtcC9zcGFubGlnaHQtcmVjb3JkLW5vZGUtSDNhSnQ3L25vZGVfbW9kdWxlcy9AYWktc2RrL3Byb3ZpZGVyLXV0aWxzL2Rpc3QvaW5kZXguanM6Mzg0NDoxMVxuICAgIGF0IHByb2Nlc3MucHJvY2Vzc1RpY2tzQW5kUmVqZWN0aW9ucyAobm9kZTppbnRlcm5hbC9wcm9jZXNzL3Rhc2tfcXVldWVzOjEwMzo1KVxuICAgIGF0IGFzeW5jIHBvc3RUb0FwaSAoZmlsZTovLy9wcml2YXRlL3RtcC9zcGFubGlnaHQtcmVjb3JkLW5vZGUtSDNhSnQ3L25vZGVfbW9kdWxlcy9AYWktc2RrL3Byb3ZpZGVyLXV0aWxzL2Rpc3QvaW5kZXguanM6MzU1MjoyNClcbiAgICBhdCBhc3luYyBwb3N0SnNvblRvQXBpIChmaWxlOi8vL3ByaXZhdGUvdG1wL3NwYW5saWdodC1yZWNvcmQtbm9kZS1IM2FKdDcvbm9kZV9tb2R1bGVzL0BhaS1zZGsvcHJvdmlkZXItdXRpbHMvZGlzdC9pbmRleC5qczozNTEzOjEyNylcbiAgICBhdCBh